{
  "base_sha": "01d880bc3176cdd8f31d72e67bb3eba54d634378",
  "diagnostic_case": "solution_key_conflict",
  "id": "qual-004",
  "kind": "qual",
  "manifest_sha256": "aaaaaaaaaaaaaaaaaaaaaaaaaaaaaaaaaaaaaaaaaaaaaaaaaaaaaaaaaaaaaaaa",
  "mutants": [
    {
      "apply_error": true,
      "killed": false,
      "name": "a.patch"
    }
  ],
  "null_base": "green",
  "oracle": "oracle-003",
  "parent": null,
  "seq": 4,
  "solution_key_green": "2/3",
  "solution_key_guards": "green",
  "solution_key_repo_test": "green",
  "spec": "spec-001"
}
